{
  "message": "Вы хотели, чтобы всё было рядом, — тут сильнее «В центре»: до центра 400 м, кругом кафе. «Дешевле» в тихом районе, до центра 3,2 км. По цене «Дешевле» выгоднее: 14 700 ₽ против 24 900 ₽. Советую «В центре»: район для вас важнее, и он в бюджете.",
  "items": [
    {
      "id": "cheapest",
      "why": "Тихо и дёшево: 14 700 ₽, но до центра 3,2 км.",
      "sacrifices": [
        "До центра 3,2 км",
        "Без завтрака"
      ],
      "risks": [],
      "not_for": []
    },
    {
      "id": "custom-1",
      "why": "Центр в 400 м и завтраки — гулять по Казани пешком.",
      "sacrifices": [
        "Дороже «Дешевле» на 10 200 ₽"
      ],
      "risks": [],
      "not_for": [
        "Тем, кто чутко спит: улица шумная до ночи"
      ]
    }
  ],
  "recommended_id": "custom-1",
  "upsell": []
}
