{
  "message": "Лучшее время для поездки в Казань — май, июнь, июль и август: днём около 18–25°; октябрь в их число не входит, но даты оставил ваши. На 30 октября – 2 ноября советую «В центре»: 24 900 ₽ с завтраками, отель в 400 м от центра. «Дешевле» — 14 700 ₽, но до центра 3,2 км. «Комфортнее» — 41 300 ₽, это на 11 300 ₽ выше вашего бюджета 30 000 ₽. Дорогу до Казани добавлю одной кнопкой, если нужна.",
  "items": [
    {
      "id": "cheapest",
      "why": "Самый бюджетный: 14 700 ₽ за 3 ночи в тихом апарт-отеле с бесплатной отменой.",
      "sacrifices": [
        "До центра 3,2 км",
        "Без завтрака"
      ],
      "risks": [],
      "not_for": []
    },
    {
      "id": "custom-1",
      "why": "Центр в 400 м, завтраки и рейтинг 8.6 — гулять по Казани можно пешком.",
      "sacrifices": [
        "Дороже «Дешевле» на 10 200 ₽"
      ],
      "risks": [],
      "not_for": [
        "Тем, кто чутко спит: улица шумная до ночи"
      ]
    },
    {
      "id": "comfort",
      "why": "Пять звёзд, спа и рейтинг 9.1 — самый уютный из трёх.",
      "sacrifices": [
        "Дороже «В центре» на 16 400 ₽"
      ],
      "risks": [
        "Выше вашего бюджета 30 000 ₽ на 11 300 ₽"
      ],
      "not_for": []
    }
  ],
  "recommended_id": "custom-1",
  "upsell": []
}
